"Eesnimi";"Perenimi";"Kasutajanimi";"Parool";"Kirjeldus"
"Õie";"Korol";"õie.korol";"3vqt1lpq";"Vastutab ettevõtte finantsjuhtimise eest, tegeleb eelarvete, aruandluse ja finantsanalüüsiga."
"Külli";"Korol";"külli.korol";"rqy81";"Tavaline süsteemi kasutaja, kes kasutab süsteemi vastavalt oma rollile ja vastutustele."
"Daaniel";"Kivimäe";"daaniel.kivimäe";"5r0113m";"Vastutab süsteemi laiade haldusülesannete eest, sealhulgas kasutajate haldus, turvaseadistused ja süsteemi konfigureerimine."
"Tauno";"Vill-Kruus";"tauno.villkruus";"pjxpz";"Loob ja arendab tarkvara, tegeleb süsteemi arendusprojektidega."
"Gerdi";"Kivimäe";"gerdi.kivimäe";"de7ki";"Tavaline süsteemi kasutaja, kes kasutab süsteemi vastavalt oma rollile ja vastutustele."
